{
  "schema_version": 1,
  "project": "pyauditor",
  "last_run": "2026-08-24T11:20:00Z",
  "baseline": {
    "tests": 652,
    "branch_coverage_percent": 86.76,
    "failures": 0,
    "skipped": 34
  },
  "completed_objectives": [
    "suite-testes/04 (summary): cobertos os branches de maior risco de orchestration/summary.py — fmt_pt_br (propriedades Hypothesis: round-trip float/Decimal contra o f'{v:.{d}f}' não-localizado, agrupamento de milhar por 3, preservação de sinal; unit de branches de erro declarados mas nunca exercidos: TypeError para str/None/bool/decimals=True/decimals='2', ValueError para inf/-inf/nan/Decimal('Infinity')/Decimal('NaN')/decimals<0), _artifact_line por tipo de resultado (Bootstrap, Split+sintetico, Measure com hard_failure, Report, Consolidate, fallback pulado/resultado indisponível/-), e render_summary(output='json') emitindo documento JSON único + output inválido levantando ValueError. 18 novos testes. summary.py 78% -> 91% branch; suíte 642 -> 652 passed. Única mudança: tests/test_orchestration_summary.py (test-only)."
  ],
  "known_risks": [
    "ty check falha no working tree com 2 diagnósticos PRÉ-EXISTENTES não introduzidos por esta run: src/pyauditor/logging.py:442 (overload Logger.add do loguru) e tests/test_orchestration_summary.py:334 (_FakeRunResult não é RunResult em _all_warnings; recebeu # ty: ignore[invalid-argument-type] no padrão da suíte). state.json anterior (08-22) estava defasado — já não refletia o estado real dos gates.",
    "ruff check src tests no working tree: 120 erros pré-existentes (cli/main.py, engine/pipeline.py, ui/server.py, tests/test_*_ratio* e outros do trabalho sintético/ratio em andamento), fora do escopo desta mudança test-only. O arquivo tocado passa em ruff check + ruff format.",
    "bandit -r src reporta 3 High pré-existentes (src não tocado nesta run) — defasado vs. registro de 08-22 que dizia 0.",
    "Branches remanescentes de summary.py: _result_panel com exit_code 0/3 puro, consolidated is None, duration_ms is None, total_pontos em variantes int/str/Decimal, glosa_states com 'não calculada' — exigem RunResult completo com estados específicos via execute_run.",
    "periodo.py (79% branch) e interactive/provider.py (56%, fronteira Questionary) seguem como dívida de cobertura de fronteira."
  ],
  "next_objective": "Cobrir os branches restantes de _result_panel em orchestration/summary.py (publicação por exit_code 0/3, total_pontos nas variantes int/str/Decimal, duration_ms is None, consolidado ausente) com fixtures de execute_run já existentes, e/ou tratar os 2 diagnósticos pré-existentes de ty e os 120 de ruff no working tree para re-verdejar os gates completos (fail_under=85 já satisfeito com 86.76%)."
}
